seller_id,product_brand,product_id,product_title,price,sale_percentage,price_pre_sale,category
52615893,Matsuya,1328681726040,"Cháo ăn dặm gạo Koshihikari, thịt trắng và rau (vị sò điệp) Matsuya (6m+)",39000,54,85000,Thực phẩm ăn dặm
22153591,Men No Sato,8198996937980,MÌ ăn dặm hữu cơ cho bé vị bông cải xanh 200g Men No Sato,79000,17,95000,Thực phẩm ăn dặm
22157997,Men No Sato,3554987499496,MÌ ăn dặm hữu cơ cho bé vị Bắp ngô Corn 200g Men No Sato,79000,17,95000,Thực phẩm ăn dặm
22152764,Men No Sato,6448183401599,MÌ ăn dặm hữu cơ cho bé vị bí ngô 200g Men No Sato,79000,17,95000,Thực phẩm ăn dặm
22142221,Men No Sato,4990756895158,Mì ăn dặm hữu cơ cho bé vị lúa mì Plain Wheat 200g Men No Sato,79000,17,95000,Thực phẩm ăn dặm
37940689,Nissin,7672541827236,"Mì ăn dặm cho trẻ trên 1 tuổi Nissin MUG Cup Noodle 96g (4 Gói nhỏ bên trong, 2 hương vị) - Nhập khẩu Nhật Bản",79000,31,115000,Thực phẩm ăn dặm
48632327,Matsuya,1616826746429,Cháo Gạo Koshihikari Ăn Dặm Với 5 Loại Rau Matsuya 60g,84000,7,90000,Thực phẩm ăn dặm
20558368, Pigeon,7119619305376,Bánh ăn dặm súp lơ & rau chân vịt (7g x 2 gói) - Nội địa Nhật Bản,67000,55,150000,Thực phẩm ăn dặm
22153960,Men No Sato,8011489304109,MÌ ăn dặm hữu cơ cho bé vị cà chua 200g Men No Sato,79000,17,95000,Thực phẩm ăn dặm
22157760,Men No Sato,9412280262015,MÌ ăn dặm hữu cơ cho bé vị củ dền Beetroot 200g Men No Sato,79000,17,95000,Thực phẩm ăn dặm
37967403,Nissin,6277506952919,"Combo 2 Gói Mì ăn dặm cho trẻ trên 1 tuổi Nissin MUG Cup Noodle 96g (Gói trắng, 2 hương vị) ",169000,27,230000,Thực phẩm ăn dặm
48968327,Haeswim,8621106808394,"Combo 4 vị Sữa chua sấy lạnh Haeswim Hàn Quốc cho bé - Vị Việt Quất, Chuối, Táo, Dâu",300000,5,316000,Thực phẩm ăn dặm
53840663,quintesens,8849212797160,Dầu ăn hữu cơ tảo biển Quintesens dành cho bé ăn dặm từ 4 tháng tuổi trở lên (Chai 250ml),259000,19,319000,Thực phẩm ăn dặm
55597311, Pigeon,8914491112451,Bánh ăn dặm vị cá mòi 7 tháng - Nội địa Nhật Bản,58500,61,150000,Thực phẩm ăn dặm
55596696, Pigeon,8809295241349,Bánh ăn dặm vị cá mòi 6 tháng - Nội địa Nhật Bản,65000,57,150000,Thực phẩm ăn dặm
55598882, Pigeon,7468847124526,Bánh ăn dặm vị cá cơm biển 7 tháng - Nội địa Nhật Bản,58500,61,150000,Thực phẩm ăn dặm
56271514,Matsuya,6955701366730,Cháo Ăn Dặm Matsuya Nhiều Vị Lựa Chọn Gói 60gr - Tặng Gói Nhỏ 30Ggr,85000,6,90000,Thực phẩm ăn dặm
48758762,Nutricara,8103281378355,Bột ăn dặm MetaCare Yến Mạch Chuối & Olive 200g,63000,3,65000,Thực phẩm ăn dặm
47245635,Ajinomoto,9694046841423,Dầu vừng 70g,69000,19,85000,Thực phẩm ăn dặm
52256747,Matsuya,4262499780894,Combo 4 gói cháo Matsuya 60g  tặng bộ bát ăn dặm,320000,24,420000,Thực phẩm ăn dặm
48632333,Matsuya,2562669698533,Cháo Gạo Koshihikari Ăn Dặm Với Cà Chua Chín Và Nấm Matsuya 60g,84000,7,90000,Thực phẩm ăn dặm
36699140,Anphaco,2080165740209,3 gói thực phẩm Bột Đậu tương lên men kiểu Nhật Natto Anphaco ăn dặm dành cho bé và mẹ,510000,22,650000,Thực phẩm ăn dặm
54759336,Nissin,6788618319106,Combo 2 gói mì MUG Nhật Bản cho bé - vị thịt heo,169000,11,190000,Thực phẩm ăn dặm
55806464,Eucatana,1296451013532,Lọ Viên Ngậm Ho Eucatana (400 Viên),180000,45,330000,Thực phẩm ăn dặm
55514477,Doya Hoya,9422524270157,"Combo 5 gói Bánh gạo ăn dặm Hữu cơ Doya Hoya Hàn Quốc cho bé - Vị Nguyên chất, Vị Táo & Cà rốt, Vị Rong biển, Vị bí đỏ, Vị Khoai lang tím",320000,6,340000,Thực phẩm ăn dặm
15817340,Heinz,8003239825743,Hộp 12 Gói Bánh Ăn Dặm Heinz Vị Chuối,468000,4,487000,Thực phẩm ăn dặm
36284004,Anphaco,4435129559973,Combo 5 gói Bột Đậu tương lên men kiểu Nhật Natto Anphaco ăn dặm dành cho bé và mẹ,750000,17,900000,Thực phẩm ăn dặm
54881972,Ponn,9572883428413,Sinh tố trái cây hữu cơ Ponn - món ăn dinh dưỡng cho bé,14500,50,29000,Thực phẩm ăn dặm
11443511,Bourbon,6957474365156,Bánh Ăn Dặm Cho Bé BOURBON KIDORIKO 55g - Nội địa Nhật Bản,49000,39,80000,Thực phẩm ăn dặm
55351035,Tana,1983996835551,Viên Ngậm La Hán Quả Tana (8 Viên x 3),70000,13,80000,Thực phẩm ăn dặm
49556886,Metacare,2029268776425,Bột ăn dặm dinh dưỡng Metacare Yến Mạch Gạo Lức 4 vị Ngọt phát triển toàn diện (200g),67000,3,69000,Thực phẩm ăn dặm
48632329,Matsuya,2469983544310,Cháo Gạo Koshihikari Ăn Dặm Với Rau Và Rong Biển Matsuya (Vị Sò Điệp) 60g,84000,7,90000,Thực phẩm ăn dặm
52615899,Matsuya,4276827931452,Cháo ăn dặm gạo Koshihikari với 5 loại rau Matsuya (5m+),39000,54,84000,Thực phẩm ăn dặm
56877305,Streptana,8330353402919,Lọ Viên Ngậm Streptana (400 Viên),190000,42,330000,Thực phẩm ăn dặm
22969090,Nhân Thùy,7247154925534,Mạch nha Nhân Thùy ,85000,11,95000,Nấu ăn và làm bánh
39225375,Đặc sản Ngon Lành,5381709384741,Đường thốt nốt truyền thống hũ thủy tinh 500g - Đặc sản Ngon Lành,78000,12,89000,Nấu ăn và làm bánh
36023748,ROVIN,6887309331561,Bột Rau Câu Giòn Agar Rovin (Gói 50g) ,34000,15,40000,Nấu ăn và làm bánh
51600754,Berryland,4649769339929,Nước cốt hoa Atiso đỏ BerryLand 500ml,46200,29,65000,Nấu ăn và làm bánh
53466002,BENUSCream,4595675523399,Bột Làm Kem Tươi Cao Cấp BENUSCream ,139000,18,170000,Nấu ăn và làm bánh
52664760,BENUSCream,1730313427193,ComBo 3kg Bột Làm Kem Tươi Hương Vani -  kem vani 3gói túi 1kg BENUSCream,229000,12,260000,Nấu ăn và làm bánh
53004966,Ngọc Trang,6546960329194,"Combo 2KG Đường Thốt Nốt Ngọc Trang - 9 viên lớn (2 bịch x 1KG) - Siêu thơm ngon, giữ được mùi thốt nốt đặc trưng, an lành - tốt cho sức khỏe có thể thay thế đường tinh luyện trong nấu ăn hằng ngày",119000,20,148000,Nấu ăn và làm bánh
31265457,Food Passion,3679220515570,Hạnh nhân bột 100g,38000,5,40000,Nấu ăn và làm bánh
52662452,Royal Farm,2529702726714,Hạnh nhân bột Royal Farm 500g/túi,160000,16,190000,Nấu ăn và làm bánh
8072638,VCOLORS,3857925352991,Màu thực phẩm VCOLORS hộp 4 màu,72000,4,75000,Nấu ăn và làm bánh
54508219,Nông Sản Vàng,4371744892630,Hạt Đười Ươi Bay 100gr - Nông Sản Vàng,59000,16,70000,Nấu ăn và làm bánh
8353611,House Foods,4051038017078,Combo 06 hộp Bột làm bánh Flan Purin Mix House Foods,140000,7,150000,Nấu ăn và làm bánh
15724202,Golden Farm,2473832445833,Bơ Hạt Phỉ Cacao Golden Farm (340g),75000,7,81000,Nấu ăn và làm bánh
39565617,OEM,7660960901149,ỐP LƯNG GỖ DÀNH CHO ĐIỆN THOẠI IPHONE Chữ Quotes THE BEST IS YET TO COME,199000,33,299000,Nấu ăn và làm bánh
58452057,Biên Hòa,8758924861246,Đường Biên Hòa Đường Đen Nữ Hoàng (1kg),49000,11,55000,Nấu ăn và làm bánh
52778757,berrino,9256263010930,Sinh tố Berrino Đào 1L,81000,10,90000,Nấu ăn và làm bánh
21881335,kim uy long,7404234871543,Bột nếp chín (bánh in) COOKED GLUTINOUS RICE FLOUR 1kg,34500,1,35000,Nấu ăn và làm bánh
14335086,Hershey's,1053089019752,Si rô Hershey's Syrup Caramel 625g,99000,29,139000,Nấu ăn và làm bánh
54507119,Nông Sản Vàng,1678656974830,Chuối Hột Rừng Bóc Vỏ Sấy Khô 1kg - Nông Sản Vàng,99000,18,120000,Nấu ăn và làm bánh
50474902,Sottolestelle,8331519432528,Bột hạt lanh nguyên cám hữu cơ Sottolestelle 500g Organic Whole FlaxSeed Meal,234000,8,255000,Nấu ăn và làm bánh
15724199,Golden Farm,2331860824146,Topping Sôcôla Golden Farm (630g),62000,9,68000,Nấu ăn và làm bánh
45084022,Ubon,2707401303706,Bột năng hữu cơ Ubon 400g,99000,10,110000,Nấu ăn và làm bánh
20651050,VINASYRUP,5333256743458,SIRO VINASYRUP HƯƠNG DÂU 750ML,55000,8,60000,Nấu ăn và làm bánh
55021635,Nông Sản Vàng,3022657322394,Hạt Đười Ươi Bay Cao Cấp 200gr - Nông Sản Vàng,109000,27,149000,Nấu ăn và làm bánh
39311501,VINASYRUP,1233289314912,Siro Đào VinaSyrup  750ml,55000,8,60000,Nấu ăn và làm bánh
20932947,Sunity,8534729666343,Thạch Cao Quy Linh Sunity,31000,11,35000,Nấu ăn và làm bánh
29263841,GABAN,8369325986065,Trân châu trắng Gaban 100g,128000,5,135000,Nấu ăn và làm bánh
8248375,House Foods,5838220841500,Combo hộp Bột làm Kem Đá Nhật Bản Shirbie - House Foods,54000,10,60000,Nấu ăn và làm bánh
55022524,Nông Sản Vàng,1400049685265,Hạt Đười Ươi Bay Cao Cấp 500gr - Nông Sản Vàng,249000,25,332000,Nấu ăn và làm bánh
6676801,ROVIN,9832780117200,Bột Rau Câu Pha Sẵn Hương Trà Xanh Matcha Rovin (Hộp 60g),22000,12,25000,Nấu ăn và làm bánh
20854417,VINASYRUP,5147424682124,Siro Vinasyrup hương Bạc hà,55000,8,60000,Nấu ăn và làm bánh
40776509,ARADO FASHION,4499606543749,ÁO THUN NAM NGẮN TAY THUN LẠNH THỂ THAO CÁ TÍNH - FMPS098,109000,39,179000,Trang phục thể thao nam
31568978,ARADO FASHION,7642251793107,Áo Thun Nam Sát Nách Thể Thao - FMTD095,89000,44,159000,Trang phục thể thao nam
35345882,BẢO ĐĂNG,9657809467094,BỘ THỂ  THAO  NAM ANGANTE SIÊU  ĐẸP,89000,40,149000,Trang phục thể thao nam
50678152,OEM,7341082117204,"Quần dài thể thao nam, quần dáng bó ống khỏe khoắn, phong cách lính New arrival 05",125000,58,300000,Trang phục thể thao nam
58384528,OEM,5989557820093,Quần dài thể thao nam rằn ri,110000,27,150000,Trang phục thể thao nam
13986093,Li-Ning,1813058272133,Áo Polo thể thao nam có cổ Li-Ning APLJ309-02,299000,60,750000,Trang phục thể thao nam
32677330,ALUVI,6119111164830,"Áo Hỗ Trợ Đốt Mỡ Bụng, Giảm Cân Nhanh Chóng Cho Nam ALUVI ADM1902 - Bí Quyết Có Cơ Bụng 6 Múi",119000,34,180000,Trang phục thể thao nam
11614349,OEM,7699641526500,Bộ quần áo bóng rổ Chicago - Đen,149000,44,268200,Trang phục thể thao nam
56833555,MAKAN,6179228077270,"Áo bóng đá đẹp, áo đá bóng và áo đá banh Áo Đội Tuyển Đức BD056",169000,23,219000,Trang phục thể thao nam
20744378,OEM,8419119029147,Bộ quần áo thể thao nam phối màu,300000,40,500000,Trang phục thể thao nam
54639864,OEM,4190304012017,áo thun nam tập gym cao cấp thun lạnh 4 chiều ,145000,41,245000,Trang phục thể thao nam
56509400,BENDU,1956857113846,Quần thể thao nam Bendu QB2003 hàng chính hãng,130000,40,215000,Trang phục thể thao nam
51613144,NGUYEN HAU,9323075159024,Áo Thể Thao Nam Cổ Tròn NT Nguyễn Hậu 018,94000,15,110000,Trang phục thể thao nam
10692176,Sportslink,5075515589222,Bộ Đồ Bóng Rổ CPSports Sportslink BONGRO-DO - Đỏ,108000,53,231000,Trang phục thể thao nam
20117671,BẢO ĐĂNG,9174094070001,BỘ  THỂ  THAO  NAM MẪU  MỚI NHẤT ZTSH  2019 ,79000,47,149000,Trang phục thể thao nam
56198056,OEM,5004829644624,"Set Đồ Nam Thể Thao Cộc Tay Siêu Thoáng Mát Và Thấm Mồ Hôi NK.1 Gồm Áo Cotton, Quần Vải Dù",109000,40,182000,Trang phục thể thao nam
41824090,OEM,3811809777713,Áo Thể Thao Bóng Đá Mẫu Bia Cực Độc - Bia Tiger,119000,18,145000,Trang phục thể thao nam
49386221,OEM,1272327389857,Bộ Quần Áo Bóng Đá Đội Tuyển Việt Nam Đỏ - Đồ Đá Banh Mới Nhất 20-21,110000,45,200000,Trang phục thể thao nam
21053108,Gymlink,2826264894395,Áo thun thể thao nam body MP3M,135000,58,321000,Trang phục thể thao nam
56834274,MAKAN,2541051994644," Áo bóng đá đẹp, áo đá bóng và áo đá banh BD206",169000,23,219000,Trang phục thể thao nam
46757680,OEM,6861239604032,Bộ Quần Áo Bóng Đá Không Logo Tự Thiết Kế BU Predator Xanh Đen - Đồ Đá Banh Mới,119000,41,200000,Trang phục thể thao nam
13857214,Unique Apparel,3278815572204,Áo Body Thể Thao Nam Tay Dài Xỏ Ngón Unique Apparel ABTDXND - Đen,134000,16,159000,Trang phục thể thao nam
59151652,OEM,7677316890521,Bộ đồ thể thao nam chất mềm mịn thoáng mát,130000,37,205000,Trang phục thể thao nam
58384499,OEM,3085587427379,Quần dài thể thao nam 1 sọc lớn QTT09,99000,34,150000,Trang phục thể thao nam
16719313,YESURE,1645279419352,"Quần Bơi Nam Thiết Kế Vảy Cá Mập Yesure Chống Thấm Nước , Nhanh Khô  Tặng Kèm Nón Bơi và Bịt Tai Silicon Cao Cấp ",149000,36,232200,Trang phục thể thao nam
51670585,OEM,7004301963180,Áo Thể Thao Body Giữ Nhiệt Dài Tay AS11,78000,41,132000,Trang phục thể thao nam
15469868,OEM,4885709614477,Bộ Quần Áo Bóng Juventus Galaxy  - Đồ Đá Banh Cao Cấp,108000,26,145000,Trang phục thể thao nam
34745707,Everest,4205667938925,Bộ quần áo thể thao đá banh nam thời trang Everest SM303 Nhiều màu,99000,45,179000,Trang phục thể thao nam
15322935,OEM,4867463692601,Bộ Thun Nam Hè Thể Thao VNXK,145000,17,175000,Trang phục thể thao nam
50789459,OEM,6603369507223,Quần Tập Gym Nam Cao Cấp Siêu Thoải Mái EC11,98900,54,215000,Trang phục thể thao nam
21061451,Gymlink,1031848232000,Quần Short thể thao nam GZ1788 - Đen viền trắng,128000,49,252000,Trang phục thể thao nam
13857125,Unique Apparel,7423965175157,Áo Base Layer Tập Gym Nam Tay Ngắn Đen Unique,142000,16,169000,Trang phục thể thao nam
13856862,Unique Apparel,4276286575211,Quần Thể Thao Nam Nam Training Unique Apparel QLPD - Đen,150000,16,179000,Trang phục thể thao nam
56407447,OEM,7580220244963,Đồ bộ thể thao nam,99000,45,180000,Trang phục thể thao nam
55617635,OEM,2508229042705,QUẦN THỂ THAO NAM PHỐI 1 SỌC TO,99000,55,218000,Trang phục thể thao nam
37748371,Amalife,5612875067238,"Quần Tập Gym Nam Dài Giữ Nhiệt, Quần Legging Nam Tập Thể Thao Cao Cấp Amalife",109000,46,200000,Trang phục thể thao nam
45852952,OEM,3169460434941,Quần Thể Thao Nam Đen Sọc ONGTHUONG98 (Ống Thường),99000,51,200000,Trang phục thể thao nam
43864635,OEM,2029523408085,Đồ Bộ Nam Bộ Thể Thao Bộ Hè Cánh Chim Đỏ Đen Trắng BC88,99000,40,165000,Trang phục thể thao nam
35290201,NGUYEN HAU,9497528919296,Quần Short Thể Thao Nam Nguyen Hau - 009,113000,25,150000,Trang phục thể thao nam
15662740,Dunlop,6570151389537,Quần Tennis nam Dunlop - DQTES9124-1S,280000,15,330000,Trang phục thể thao nam
51411840,OEM,6044182539518,Bộ Quần Áo Bóng Đá CLB HAGL Xanh Đen - Đồ Đá Banh Mới Nhất 20-21,110000,45,200000,Trang phục thể thao nam
31650333,OEM,1762211469920,Bộ đồ Nam Thể Thao TDBN4,74500,61,189000,Trang phục thể thao nam
35290226,NGUYEN HAU,6979886122769,Quần Short Thể Thao Nam Nguyen Hau - 010,113000,25,150000,Trang phục thể thao nam
57652009,OEM,7396673928196,Quần thể thao tập gym nam có khóa túi,59000,34,89000,Trang phục thể thao nam
20740588,OEM,9481760922831,Bộ Áo Đấu CLB Liverpool Đen Thủ Môn Dài Tay 2019 2020 Cực Chất,125000,24,165000,Trang phục thể thao nam
32157475,OEM,5985743993008,Đồ Bộ Thể Thao Nam Nữ Smile,99000,52,207000,Trang phục thể thao nam
24183137,OEM,3288346747941,Tai nghe Bluetooth gắn mũ bảo hiểm BT8 - Hàng nhập khẩu,399000,39,650000,Tai Nghe Bluetooth Đàm Thoại
17495228,Kashimura,5101519961358,Tai Nghe Bluetooth Đàm Thoại Kashimura BL-23 3.0 Đen Bạc - Hàng Chính Hãng,279000,30,399000,Tai Nghe Bluetooth Đàm Thoại
24998195,Baseus,5116423144476,"Tai nghe Bluetooth Baseus Encok BA01 Earphones Kết nối cùng lúc 2 thiết bị khử tiếng ồn cao cấp 10h đàm thoại, Bluetooth 4.1 - Hàng chính hãng",198000,51,400000,Tai Nghe Bluetooth Đàm Thoại
24997283,TAKO,2697574136082,Tai nghe Nghe Nhạc - Học Ngoại Ngữ - Đàm thoại Tako 74 - Hàng Chính Hãng,160000,24,210000,Tai Nghe Bluetooth Đàm Thoại
23025336,Remax,8328334188105,Tai nghe Bluetooth Remax RB-T1 - Hàng chính hãng,125000,61,323700,Tai Nghe Bluetooth Đàm Thoại
24184217,OEM,3479575358644,Tai nghe Bluetooth cao cấp gắn mũ bảo hiểm BT10 - Hàng nhập khẩu,550000,35,850000,Tai Nghe Bluetooth Đàm Thoại
34544374,Hoco,3713210572515,Tai Nghe Bluetooth Hoco E37 Gratified Business V4.1  + Tặng Iring Khay - Chính Hãng ,380000,24,499000,Tai Nghe Bluetooth Đàm Thoại
22783574,Remax,5074946337822,Tai Nghe Bluetooth 1 Bên Remax T13 - Hàng Chính Hãng ,179000,82,999000,Tai Nghe Bluetooth Đàm Thoại
3433919,Losence,3389334806647,Tai Nghe Bluetooth Losence i3 ,219000,29,308000,Tai Nghe Bluetooth Đàm Thoại
6474751,OEM,3626039566279,"Loa Nghe Nhạc F27 Vỏ Hợp Kim Hỗ Trợ Bluetooth, Thẻ Nhớ, Đàm Thoại Rảnh Tay",118597,41,200000,Tai Nghe Bluetooth Đàm Thoại
56491459,Hoco,3323655165540,Tai Nghe Bluetooth Hoco E37 Pin 170mAh - Đàm Thoại Trong 15 Giờ-Hàng Chính Hãng,178000,82,999000,Tai Nghe Bluetooth Đàm Thoại
16729476,Baseus,6367910671381,"Tai nghe bluetooth earphone đơn chống nước hiệu Baseus TWS A03 (Trang bị bluetooth 5.0, chống ồn, âm thanh Hifi 6D) - Hàng chính hãng ",319000,47,600000,Tai Nghe Bluetooth Đàm Thoại
26445916,OEM,5849097371267,"Loa nghe nhạc mini siêu trầm hình quả trứng hỗ trợ bluetooth, thẻ nhớ, kết nối đàm thoại (Giao màu ngẫu nhiên)",128900,56,290000,Tai Nghe Bluetooth Đàm Thoại
10125660,OEM,9863756766016,"Loa bluetooth tích hợp 2 loa rời 3W, khe thẻ nhớ và mic đàm thoại bali-f4",150000,62,399000,Tai Nghe Bluetooth Đàm Thoại
25362366,Roman,8150759005466,Tai nghe không dây cao cấp Neck Bluetooth Headset Roman Z7000A - Hàng Nhập Khẩu,624000,49,1220000,Tai Nghe Bluetooth Đàm Thoại
23446382,Remax,4959574780121,Tai nghe Bluetooth Remax RB-T15 - Hàng nhập khẩu,215000,45,389000,Tai Nghe Bluetooth Đàm Thoại
50587019,FONENG,2337306467663,Tai nghe bluetooth Foneng BL01 một bên tai kèm dock sạc (hàng nhập khẩu),215000,14,249000,Tai Nghe Bluetooth Đàm Thoại
32261119,PKCB,1226605695765,Tai Nghe Nhét Tai Bluetooth PKCB75 - Hàng Chính Hãng,195000,72,700000,Tai Nghe Bluetooth Đàm Thoại
14069304,OEM,5211998241367,Tai nghe bluetooth đàm thoại,89000,78,399000,Tai Nghe Bluetooth Đàm Thoại
43586780,HUKEY,5025525544230,Tai nghe bluetooth siêu nhỏ -siêu bass-cảm ứng nhạy-độ trễ cực thấp  Hukey S8 plus (S8P) - Đèn LED siêu thời trang - Công nghệ kết nối thông minh - Hukey S8+ - Chính hãng,490000,39,800000,Tai Nghe Bluetooth Đàm Thoại
31530749,AuKey,9334532968233,Tai Nghe Bluetooth Đàm Thoại Aukey EP-B35 Đen - Hàng Chính Hãng,419000,29,590000,Tai Nghe Bluetooth Đàm Thoại
10705224,Jabra,6931979515636,Tai Nghe Bluetooth Đàm Thoại Jabra Talk 25 - Hàng Chính Hãng,1089000,8,1190000,Tai Nghe Bluetooth Đàm Thoại
10705223,Jabra,4132751270046,Tai Nghe Bluetooth Đàm Thoại Jabra Talk 15 - Hàng Chính Hãng,790000,11,890000,Tai Nghe Bluetooth Đàm Thoại
51995798,Hoco,6849870469180,Tai Nghe Bluetooth Hoco E37 - Hàng Chính Hãng,199000,93,3000000,Tai Nghe Bluetooth Đàm Thoại
10651538,OEM,6485786465887,Tai nghe bluetooth 5.0  đàm thoại 24h K21 mới nhất ,180000,57,422000,Tai Nghe Bluetooth Đàm Thoại
14235593,EX,9426605629124,Tai nghe bluetooth kèm micro EX-01 - Hàng chính hãng,299000,34,450000,Tai Nghe Bluetooth Đàm Thoại
5448723,Baseus,8553732454228,"Tai nghe Bluetooth Baseus Encok Mini Wireless Earphone kết nối cùng lúc 2 thiết bị (5h đàm thoại, Bluetooth 4.1, Cảm ứng chạm) - Hàng chính hãng",279000,30,400000,Tai Nghe Bluetooth Đàm Thoại
55595412,Hoco,1114766348609,Tai Nghe Bluetooth Hoco E31 - Hàng Chính Hãng,129000,51,265000,Tai Nghe Bluetooth Đàm Thoại
48698337,OEM,5660179083836,Tai nghe Bluettooth KC002 dùng cho mũ bảo hiểm 3/4 và fullface,470000,4,490000,Tai Nghe Bluetooth Đàm Thoại
14204507,OEM,4382668606647,Tai Nghe Bluetooth Móc Tai K5 4.0,249000,48,479000,Tai Nghe Bluetooth Đàm Thoại
53004210,FBT,6334943124825,"Tai nghe 2 tai Bluetooth không dây i9s chính hãng cho IPhone, Android + Tặng móc dán siêu dính",315000,68,980000,Tai Nghe Bluetooth Đàm Thoại
54478165,X-PRO,7346785618010," Tai nghe Bluetooth X-PRO chuyên game di động PUBG, RULES OF SURVIVAL NTh - Màu ngẫu nhiên - Hàng nhập khẩu",230000,21,290000,Tai Nghe Bluetooth Đàm Thoại
10831017,OEM,5536068422331,Tai Nghe Bluetooth Không Dây 7S Hỗ Trợ Đàm Thoại Rảnh Tay (màu ngẫu nhiên),88000,41,150000,Tai Nghe Bluetooth Đàm Thoại
32864353,Jabra,1855327945461,TAI NGHE BLUETOOTH JABRA EASYGO - Hàng Nhập Khẩu,249000,45,450000,Tai Nghe Bluetooth Đàm Thoại
16870720,ROBINLUX,8456505444573,Tai nghe Bluetooth F600 âm thanh trung thực,599000,47,1120000,Tai Nghe Bluetooth Đàm Thoại
11341657,Joway,5257596269693,Tai nghe bluetooth đàm thoại Joway H58 - Hàng chính hãng,155000,23,200000,Tai Nghe Bluetooth Đàm Thoại
56256165,Earldom,3594442520594,Tai nghe Bluetooth không dây thể thao quàng cổ nghe nhạc trong 10h Earldom BH13 - hàng nhập khẩu,299000,40,500000,Tai Nghe Bluetooth Đàm Thoại
23242954,Hoco,3881052222131,Tai Nghe Bluetooth Hoco E43 Wireless V5.0 + Tặng Dây Đeo Silicon - Chính Hãng ,499000,17,599000,Tai Nghe Bluetooth Đàm Thoại
20050011,Plantronics,5693979140232,Bộ Tai Nghe Bluetooth Plantronics Voyager 5200 Và Hộp Sạc Dự Phòng - Hàng Chính Hãng,3190000,18,3890000,Tai Nghe Bluetooth Đàm Thoại
11664185,MPOW,3433430649131,Tai Nghe Khử Ổn Bluetooth Không Dây Đàm Thoại Cao Cấp MPOW  - Hàng chính hãng,2000000,44,3600000,Tai Nghe Bluetooth Đàm Thoại
42843427,Remax,3913712608556,Tai nghe Bluetooth v5.0 Sang Trọng Remax RB - T1 + Tặng Gía Đỡ Điện Thoại Mini - Chính Hãng ,150000,79,699000,Tai Nghe Bluetooth Đàm Thoại
10785498,OEM,4150786426184,Combo Bộ 3 Loa Máy Tính USB D-202 + Tai nghe chụp tai kèm mic đàm thoại CT-770  (Màu Ngẫu Nhiên),349000,42,600000,Tai Nghe Bluetooth Đàm Thoại
44154778,VINETTEAM,1819123419755,Tai Nghe Bluetooth TWS F95 Tai Nghe Nhét Tai Nút Bấm Cảm Ứng Hiển thị pin LED + ghép nối bật nguồn tự động + Hiệu ứng âm thanh +Túi Đựng Cao Cấp- Hàng Chính Hãng,389000,22,500000,Tai Nghe Bluetooth Đàm Thoại
46107381,OEM,2208192225944,Tai nghe không dây gắn mũ bảo hiểm MH04 - Hàng nhập khẩu,399000,11,449000,Tai Nghe Bluetooth Đàm Thoại
46607806,Hoco,9639026086104,Tai Nghe Bluetooth V5.0 Nhét Tai -Hoco E39 Admire Sound Single  + Tặng Dây Đeo Silicon - Chính Hãng ,698999,30,999000,Tai Nghe Bluetooth Đàm Thoại
49927886,Hatoza,2327344889398,Tai Nghe Bluetooth F900 V 5.0 bản Doanh Nhân - Tai Nghe Không Dây Super BASS - Pin Trâu 25h Liên Tục - Hàng Chính Hãng HTZ02,499000,17,599000,Tai Nghe Bluetooth Đàm Thoại
41374319,Remax,2274325644579,Tai Nghe Bluetooth Remax RB-T9 + Tặng Kèm 1 Cáp Sạc IPhone - Hàng Chính Hãng,199000,36,310000,Tai Nghe Bluetooth Đàm Thoại
42402462,OEM,3893443004134,Xăng đan bé trai,99000,50,199000,Giày bé trai
27956231,OEM,4368329063158,Dép sandal bé trai 6 - 15 tuổi kiểu dáng Hàn Quốc khỏe khoắn và phong cách SG20,300000,14,350000,Giày bé trai
48961099,OEM,9988419225348,sandal bé trai siêu mềm cực êm chân,119000,21,150000,Giày bé trai
43127448,OEM,6788374351518,Giày da đế khâu dành cho bé DA01,227000,23,295000,Giày bé trai
20483451,OEM,4286422620118,Dép lê bé trai và bố mẹ siêu êm và thoáng chân,139000,54,299000,Giày bé trai
55777637,OEM,6640604115966,Dép sandal  bé trai dv85,385000,3,395000,Giày bé trai
53997952,OEM,4956808157476,Dép đúc Thái Lan hai quai trẻ em 9LS KIDS,130000,28,180000,Giày bé trai
11490797,OEM,3982766803859,Giày Thể Thao 1-15 Tuổi Cho Bé Trai Và Bé Gái GT1,200000,20,250000,Giày bé trai
50192116,OEM,4705677344551,"Giày Siêu Nhân Cho Bé Trai 2 - 8 tuổi siêu nhẹ, êm chống trơn trượt là dòng sản phẩm dành cho các bé năng động, yêu thích các nhân vật siêu nhân",169000,21,215000,Giày bé trai
56863663,OEM,3983416322393,Dép sục đi mưa cho bé gắn sticker con vịt,180000,36,280000,Giày bé trai
13720386,OEM,1193529419459,Giày sandal trẻ em thời trang T255K130 - Đen,79000,58,189000,Giày bé trai
50191076,OEM,7386401674785,Dép sục bé trai 2 - 5 tuổi siêu nhẹ kháng khuẩn nhanh ráo nước họa tiết đáng yêu D27,110000,33,165000,Giày bé trai
11537064,OEM,9590842301980,Giày sandal bé trai 1 - 6 tuổi SD92,200000,27,275000,Giày bé trai
52286515,New Balance,7955661109094,Giày Thể Thao Bé Trai New Balance YV996CBL,648000,50,1295000,Giày bé trai
16169562,OEM,2069362320025,"Giày sandal bé trai, bé gái thời trang T253K322 - Đen",79000,58,189000,Giày bé trai
54061641,Biti's Việt Nam,6056459343162,Sandal Si PU Biti's Bé Gái DPG000688,242000,10,269000,Giày bé trai
55906157,Crown Space,2943689078961,Xăng đan bé trai CrownUK Active Sandals CRUK524,389000,56,889000,Giày bé trai
44150384,OEM,6141415259097,DÉP SANDAL CHO BÉ TRAI NĂNG ĐỘNG XD03,170000,29,240000,Giày bé trai
16687192,OEM,9047949016601,Dép sandal bé trai đế kếp êm chân và siêu bền DQ07,166000,44,299000,Giày bé trai
54615933,OEM,2344658023140,"Dép Sục Cho Bé Trai Và Bé Gái - Tặng Kèm Sticker, Bền Đẹp - Siêu Êm Mềm - Chất Liệu Cao Cấp - ",118000,31,170000,Giày bé trai
