seller_id,product_brand,product_id,product_title,price,sale_percentage,price_pre_sale,category
7536105,Biti's Việt Nam,5349201970329,Giày Sandal TPR Bé Trai Biti's Spiderman DTB069811,269000,10,299000,Giày bé trai
10713024,OEM,2095255603548,Sandal bé trai kiểu bít mũi năng động và cá tính XD51,290000,17,349000,Giày bé trai
55559882,OEM,6417205225277,Giày sandal mũi bọc bảo vệ chân cho bé trai bé gái hình đôi bạn thỏ,89000,25,119000,Giày bé trai
55099006,OEM,6152929091615,Sandal Cho Bé Trai 3 - 15 Tuổi Đi Học Đi Chơi Êm Chân,270000,23,350000,Giày bé trai
31692932,OEM,2236202302019,Giày thể thao cho bé trai 4 - 12 tuổi siêu nhẹ GE18,300000,14,350000,Giày bé trai
41574726,OEM,3065320795286,"Giày Trẻ Em Người Nhện Cho Bé Trai Bé Gái Từ 4-12 Tuổi Đế Cao Su Non Đúc Hình Người Nhện Đáng Yêu Chất Liệu Da Mềm Êm Chân Bé, Nhám Dính Cố Định Tiện Lợi",299000,33,449000,Giày bé trai
36950976,OEM,6548107493393,Sandal bé trai hàng cao cấp,99000,42,170000,Giày bé trai
778852,Biti's Việt Nam,5476605314630,Dép Xốp Bé Trai Biti's Cars DXB119611XDG - Xanh Dương,161000,10,179000,Giày bé trai
54631833,OEM,5351216343173,Giày sneaker bé trai cao cấp_QN217M,275000,21,350000,Giày bé trai
44137632,OEM,9470044756361,Giày da phong cách dành cho bé trai DA02,157000,23,204000,Giày bé trai
11508482,Prowin,7605947119773,Giày Đá Bóng Prowin FM 501 Đinh Nhỏ Màu Đỏ (Size trẻ em),150000,50,300000,Giày bé trai
16224976,OEM,1182933460881,Giày thể thao cho bé trai và bé gái T11 đen,250000,11,280000,Giày bé trai
55355903,OEM,3452221611553,Dép sandal bé trai 1 - 3 tuổi kiểu rọ bít mũi thể thao và năng động đế chống trơn ST37,175000,22,225000,Giày bé trai
36462417,OEM,5559334163264,Giày thể thao bé trai 4 - 12 tuổi phong các sneaker cá tính GE30,280000,13,320000,Giày bé trai
27927533,OEM,4202580841042,Giày thể thao bé trai 3 - 12 tuổi phong cách khỏe khoắn và năng động GE13,310000,16,370000,Giày bé trai
29060454,Prowin,1599249139293,Giày đá bóng prowin cho trẻ em màu xanh lam,150898,37,239000,Giày bé trai
19828829,Biti's Việt Nam,8464547666433,Giày Sandal Xốp Bé Trai Biti's SXB018500,140000,10,155000,Giày bé trai
19828385,Biti's Việt Nam,3820221720665,Giày Sandal Xốp Bé Trai Biti's SXB018300,167000,10,185000,Giày bé trai
11295171,OEM,2790419908094,Giày Trượt Thể Thao Bánh Xe Cho Bé Trai 3 - 15 Tuổi GB01,425000,19,525000,Giày bé trai
43016620,OEM,8754496598672,GIÀY THỂ THAO HÀN QUỐC CHO BÉ TRAI NĂNG ĐỘNG,210000,28,290000,Giày bé trai
24401484,OEM,8548660492237,"Giày sandal bé trai, bé gái thời trang T248K322 - Đen",78000,54,169000,Giày bé trai
57588698,Crocs,1358819563674,Giày  Crocs Clog Trẻ em 204536,397500,50,795000,Giày bé trai
8061630,Head & Shoulders,1823867422131,Combo 2 Dầu Gội Head & Shoulders Bạc Hà Mát Lạnh,289000,19,358000,"Dầu gội, dầu xả"
11620231,Aladin,7410279115313,Dầu Gội Dược Liệu Trị Chấy Aladin (30g),59500,13,68000,"Dầu gội, dầu xả"
244242,Dove,9206671335002,Combo Dove Dưỡng Tóc Bồng Bềnh: Dầu Gội 650g + Kem Xả 335g,185000,15,218000,"Dầu gội, dầu xả"
13514380,Thái Dương,2880855279602,Dầu Gội Thái Dương 3 Hương Hoa (600ml),120000,25,160000,"Dầu gội, dầu xả"
21179416,Mộc Nhu,6447416263188,Dầu gội Cỏ Mực Mộc Nhu 300ml,250000,4,260000,"Dầu gội, dầu xả"
35245630,TIGI,9493331735535,Bộ Dầu Gội và Xả Phục Hồi Tóc Tigi Bed Head Urban Antidotes Resurrection 750ml - Chính hãng ,746000,53,1590000,"Dầu gội, dầu xả"
7967541,Pantene,6412575722999,Dầu Gội Pantene Ngăn Rụng Tóc (1200ML),195000,6,207000,"Dầu gội, dầu xả"
44073872,TRESemmé,9438309149785,Dầu Gội Tresemmé Salon Detox Gừng Và Trà Xanh Detox Tóc Chắc Khoẻ (640g),157000,15,185000,"Dầu gội, dầu xả"
10117455,Mộc Nhu,9230397473670,Nước Gội Đầu Bồ Kết Và Vỏ Bưởi Mộc Nhu Trị Rụng Tóc Trị Gàu 300ml,170000,32,250000,"Dầu gội, dầu xả"
46234985,Girlz Only,3766115027901,"DẦU GỘI KHÔ GIRLZ ONLY 200ML, BỒNG BỀNH CHO TÓC BẾT, CÓ HƯƠNG THƠM, 5 PHÂN LOẠI, HÀNG CHÍNH HÃNG",99000,60,250000,"Dầu gội, dầu xả"
51930793,Pantene,1083577710113,Combo 2  Dầu Gội Pantene Ngăn Rụng Tóc 900ml [Tặng Combo 24 Gói Dầu Xả Pantene Ngăn Rụng Tóc] ,279000,19,344000,"Dầu gội, dầu xả"
17043142,TRESemmé,6481425495147,Dầu Xả Tresemmé Keratin Smooth Tinh Dầu Argan Và Keratin Vào Nếp Suôn Mượt - 620g,170000,8,185000,"Dầu gội, dầu xả"
34346451,Clear,4440924202009,Dầu Gội Sạch Gàu Clear Botanique 9 Thảo Dược Quý (630g),169000,5,178000,"Dầu gội, dầu xả"
53653426,COCAYHOALA,7110982991043,Dầu gội thảo dược HÀ THỦ Ô Chiết xuất từ 6 loại thảo dược - Cân Bằng Sắc Tố Melanin Khỏi lo bạc tóc rụng tóc Cocayhoala 300g,180000,28,250000,"Dầu gội, dầu xả"
7966016,Head & Shoulders,7189293037252,Combo 2 Dầu Gội Head & Shoulders Bạc Hà Mát Rượi (625ml x 2),289000,5,304000,"Dầu gội, dầu xả"
51933108,Pantene,4243382816647,Dầu Gội Pantene Ngăn Rụng Tóc (1200ML) - Tặng Combo 12 Dầu Xả Pantene Ngăn Rụng Tóc,199000,12,225000,"Dầu gội, dầu xả"
16625313,Dove,2062863428085,Combo Dầu Gội + Kem Xả Dove Giúp Tóc Bóng Mượt Hoa Sen & Dầu Jojoba Botanical Selection (500g/Chai),308000,12,350000,"Dầu gội, dầu xả"
7967639,Rejoice,8883979773531,Dầu Gội Rejoice Siêu Mượt (900ml),149000,7,160000,"Dầu gội, dầu xả"
14240690,Rejoice,3877021645858,Dầu Gội Rejoice Fraya Hương Hoa Mẫu Đơn 650g,109000,5,115000,"Dầu gội, dầu xả"
7961877,Fresh,3441261940204,Dầu Xả Fresh Tinh Dầu Bưởi + Tinh Chất Lá Neem (170g),25000,14,29000,"Dầu gội, dầu xả"
54709158,Thorakao,2225032868543,Dầu Gội Hoa Bưởi Thorakao 500ml,40000,42,69000,"Dầu gội, dầu xả"
13514359,Thái Dương,8365675851893,Dầu Gội Dược Liệu Thái Dương 3 Hương Hoa (1.1L),200000,26,270000,"Dầu gội, dầu xả"
56018127,TRESemmé,8411950658746,Combo Dầu Gội 640gr Và Dầu Xả 620gr TRESemmé Salon Rebond Công Nghệ Tái Kết Nối Ngăn Ngừa Gãy Rụng,307000,17,370000,"Dầu gội, dầu xả"
21082430,Dove,8242398918990,Dầu Xả Dove Óng Mềm Tự Nhiên (620g),137000,15,161000,"Dầu gội, dầu xả"
54709242,Thorakao,7496492183940,Dầu Gội Chanh - Sả - Bạc Hà Thorakao 400ml ,73000,30,105000,"Dầu gội, dầu xả"
40935833,Dove,1204659205093,Combo Dầu Gội (650g) Và Dầu Xả (620g) Dove Dưỡng Óng Tự Nhiên,274000,15,322000,"Dầu gội, dầu xả"
54477355,TSUBAKI,3285006353023,Dầu Gội Đầu TSUBAKI Ngăn Rụng Tóc (500ml) | Dầu gội,150000,16,179000,"Dầu gội, dầu xả"
7920113,TSUBAKI,3408677615621,Bộ Đôi Gội Xả TSUBAKI Phục Hồi Hư Tổn (500ml/Chai),217000,39,358000,"Dầu gội, dầu xả"
50254430,Pantene,1568420509224,Bộ Đôi Pantene Ngăn Rụng Tóc (Dầu Gội 900ml + Kem Xả 150ml),209000,7,225000,"Dầu gội, dầu xả"
218150,Dove,9209141870379,Dầu Gội Dove Dưỡng Tóc Bồng Bềnh 650g,115000,15,135000,"Dầu gội, dầu xả"
12390089,Fresh,6494041587998,Dầu gội fresh Organic Tea tree oil (500g) + Tặng 1 dầu xả fresh Tea tree (180g),99000,38,159000,"Dầu gội, dầu xả"
15863571,Obsidian,3265473975478,Dầu gội kích thích mọc tóc Obsidian Orzen Loss Control shampoo 320ml,275800,34,415000,"Dầu gội, dầu xả"
10862736,Selsun,3461658908358,Dầu Xả Dưỡng Tóc Selsun (100ml),49000,11,55000,"Dầu gội, dầu xả"
10862547,MEGUMI,3462022828166,Dầu Gội Ngăn Rụng Tóc Megumi (175g),109000,16,129000,"Dầu gội, dầu xả"
55041988,TSUBAKI,1153050596616,Bộ Đôi TSUBAKI Phục Hồi Ngăn Rụng Tóc (490ml/chai),288000,28,398000,"Dầu gội, dầu xả"
11423154,Milaganics,5042168698076,"Dầu Xả Bưởi - Phục Hồi Tóc Hư Tổn, Nuôi Dưỡng Tóc Mềm Mượt Tự Nhiên Milaganics (200ml / Chai)",72000,54,156000,"Dầu gội, dầu xả"
51854203,Sunsilk,9209282726481,Dầu Gội Sunsilk Óng Mượt Rạng Ngời 21054432 (900g),132000,18,160000,"Dầu gội, dầu xả"
3146667,Romano,9202399448178,Combo Sản Phẩm Romano Vip: Dầu Gội Cao Cấp Cho Nam (650g) + Sữa Tắm (650g),280000,22,358000,"Dầu gội, dầu xả"
47166860,X-Men For Boss,1977603445646,Dầu gội X-Men For Boss Intense - Hương trầm mạnh mẽ 650g,152000,18,186000,"Dầu gội, dầu xả"
3302953,Herbario,5599115675616,Bộ Dầu gội và Dầu xã Vỏ Bưởi & Bồ kết Herbario (270ml x 2),265606,28,370000,"Dầu gội, dầu xả"
16625311,Dove,6126188296517,Combo Dầu Gội + Kem Xả Dove Phục Hồi Hư Tổn Chiết Xuất Bơ & Dầu Argan Botanical Selection (500g/Chai),291000,17,350000,"Dầu gội, dầu xả"
